"Status","Start Time","Stop Time","Duration in ms","Parent Suite","Suite","Sub Suite","Test Class","Test Method","Name","Description"
"failed","Mon Aug 18 20:17:29 GMT 2025","Mon Aug 18 20:17:29 GMT 2025","435","API Test Suite","API Test","org.api.tests.AuthTest","org.api.tests.AuthTest","forgotPasswordTest","Verify if forgot password API is working.","This test case verifies that the forgot password functionality works correctly."
"passed","Mon Aug 18 20:17:29 GMT 2025","Mon Aug 18 20:17:30 GMT 2025","530","API Test Suite","API Test","org.api.tests.AuthTest","org.api.tests.AuthTest","loginTest","Verify if login API is working.","This test case verifies that a user can log in successfully using the Login API."
"failed","Mon Aug 18 20:17:33 GMT 2025","Mon Aug 18 20:17:34 GMT 2025","428","API Test Suite","API Test","org.api.tests.UserManagementTest","org.api.tests.UserManagementTest","updateProfileWithInvalidTokenShouldReturnUnauthorized","Verify updating profile with invalid token should return Unauthorized","This test case verifies that updating a user profile with an invalid token returns a 401 Unauthorized status."
"failed","Mon Aug 18 20:17:30 GMT 2025","Mon Aug 18 20:17:31 GMT 2025","422","API Test Suite","API Test","org.api.tests.UserManagementTest","org.api.tests.UserManagementTest","getProfileWithExpiredTokenShouldReturnUnauthorized","Verify retrieving profile with expired token should return Unauthorized","This test case verifies that retrieving a user profile with an expired token returns a 401 Unauthorized status."
"passed","Mon Aug 18 20:17:30 GMT 2025","Mon Aug 18 20:17:30 GMT 2025","946","API Test Suite","API Test","org.api.tests.UserManagementTest","org.api.tests.UserManagementTest","getProfileTest","Verify the user profile retrieval functionality.","This test case verifies that a user profile can be retrieved successfully using the User Management API."
"failed","Mon Aug 18 20:17:31 GMT 2025","Mon Aug 18 20:17:31 GMT 2025","418","API Test Suite","API Test","org.api.tests.UserManagementTest","org.api.tests.UserManagementTest","getProfileWithInvalidTokenShouldReturnUnauthorized","Verify retrieving profile with invalid token should return Unauthorized","This test case verifies that retrieving a user profile with an invalid token returns a 401 Unauthorized status."
"passed","Mon Aug 18 20:17:31 GMT 2025","Mon Aug 18 20:17:32 GMT 2025","936","API Test Suite","API Test","org.api.tests.UserManagementTest","org.api.tests.UserManagementTest","updateProfileTest","Verify the user profile update functionality.","This test case verifies that a user profile can be updated successfully using the User Management API."
"failed","Mon Aug 18 20:17:27 GMT 2025","Mon Aug 18 20:17:29 GMT 2025","1399","API Test Suite","API Test","org.api.tests.AuthTest","org.api.tests.AuthTest","createAccountTest","Verify the account creation functionality.","This test case verifies that a new user account can be created successfully using the SignUp API."
"failed","Mon Aug 18 20:17:32 GMT 2025","Mon Aug 18 20:17:33 GMT 2025","932","API Test Suite","API Test","org.api.tests.UserManagementTest","org.api.tests.UserManagementTest","updateProfileWithEmptyPayloadShouldReturnBadRequest","Verify updating profile with empty payload should return Bad Request","This test case verifies that updating a user profile with an empty payload returns a 400 Bad Request status."
