"Status","Start Time","Stop Time","Duration in ms","Parent Suite","Suite","Sub Suite","Test Class","Test Method","Name","Description"
"passed","Sat Aug 16 20:16:50 GMT 2025","Sat Aug 16 20:16:51 GMT 2025","1054","API Test Suite","API Test","org.api.tests.UserManagementTest","org.api.tests.UserManagementTest","updateProfileTest","Verify the user profile update functionality.","This test case verifies that a user profile can be updated successfully using the User Management API."
"failed","Sat Aug 16 20:16:51 GMT 2025","Sat Aug 16 20:16:52 GMT 2025","1052","API Test Suite","API Test","org.api.tests.UserManagementTest","org.api.tests.UserManagementTest","updateProfileWithEmptyPayloadShouldReturnBadRequest","Verify updating profile with empty payload should return Bad Request","This test case verifies that updating a user profile with an empty payload returns a 400 Bad Request status."
"failed","Sat Aug 16 20:16:46 GMT 2025","Sat Aug 16 20:16:47 GMT 2025","1600","API Test Suite","API Test","org.api.tests.AuthTest","org.api.tests.AuthTest","createAccountTest","Verify the account creation functionality.","This test case verifies that a new user account can be created successfully using the SignUp API."
"failed","Sat Aug 16 20:16:52 GMT 2025","Sat Aug 16 20:16:53 GMT 2025","483","API Test Suite","API Test","org.api.tests.UserManagementTest","org.api.tests.UserManagementTest","updateProfileWithInvalidTokenShouldReturnUnauthorized","Verify updating profile with invalid token should return Unauthorized","This test case verifies that updating a user profile with an invalid token returns a 401 Unauthorized status."
"passed","Sat Aug 16 20:16:48 GMT 2025","Sat Aug 16 20:16:49 GMT 2025","1062","API Test Suite","API Test","org.api.tests.UserManagementTest","org.api.tests.UserManagementTest","getProfileTest","Verify the user profile retrieval functionality.","This test case verifies that a user profile can be retrieved successfully using the User Management API."
"passed","Sat Aug 16 20:16:48 GMT 2025","Sat Aug 16 20:16:48 GMT 2025","592","API Test Suite","API Test","org.api.tests.AuthTest","org.api.tests.AuthTest","loginTest","Verify if login API is working.","This test case verifies that a user can log in successfully using the Login API."
"failed","Sat Aug 16 20:16:49 GMT 2025","Sat Aug 16 20:16:50 GMT 2025","486","API Test Suite","API Test","org.api.tests.UserManagementTest","org.api.tests.UserManagementTest","getProfileWithExpiredTokenShouldReturnUnauthorized","Verify retrieving profile with expired token should return Unauthorized","This test case verifies that retrieving a user profile with an expired token returns a 401 Unauthorized status."
"failed","Sat Aug 16 20:16:47 GMT 2025","Sat Aug 16 20:16:48 GMT 2025","490","API Test Suite","API Test","org.api.tests.AuthTest","org.api.tests.AuthTest","forgotPasswordTest","Verify if forgot password API is working.","This test case verifies that the forgot password functionality works correctly."
"failed","Sat Aug 16 20:16:50 GMT 2025","Sat Aug 16 20:16:50 GMT 2025","481","API Test Suite","API Test","org.api.tests.UserManagementTest","org.api.tests.UserManagementTest","getProfileWithInvalidTokenShouldReturnUnauthorized","Verify retrieving profile with invalid token should return Unauthorized","This test case verifies that retrieving a user profile with an invalid token returns a 401 Unauthorized status."
